{
  "$schema": "https://json-schema.org/draft/2020-12/schema",
  "$id": "https://pheat.dev/schemas/geometry-table-set.schema.json",
  "title": "PHEAT Geometry Table Set",
  "description": "Canonical JSON representation for PHEAT reconstruction geometry targets.",
  "type": "object",
  "required": [
    "format",
    "version",
    "default_profile",
    "metadata",
    "profiles"
  ],
  "properties": {
    "format": {
      "const": "pheat.geometry-table-set"
    },
    "version": {
      "const": 1
    },
    "artifact_id": {
      "type": "string"
    },
    "artifact_version": {
      "type": "string"
    },
    "artifact_label": {
      "type": "string"
    },
    "created_at": {
      "type": "string"
    },
    "pheat_version": {
      "type": "string"
    },
    "default_profile": {
      "type": "string"
    },
    "metadata": {
      "type": "object",
      "additionalProperties": true
    },
    "profiles": {
      "type": "object",
      "additionalProperties": {
        "type": "object",
        "required": [
          "metadata"
        ],
        "properties": {
          "metadata": {
            "type": "object",
            "additionalProperties": true
          },
          "backbone": {
            "type": "object",
            "additionalProperties": true
          },
          "sidechains": {
            "type": "object",
            "additionalProperties": true
          }
        },
        "additionalProperties": true
      }
    }
  },
  "additionalProperties": true
}
