{
  "artifact_id": "ccd-sidechain-geometry",
  "artifact_label": "ccd-sidechain-geometry-v1",
  "artifact_version": "v1",
  "created_at": "2026-05-21T18:07:24.051445Z",
  "default_profile": "ccd-sidechains",
  "format": "pheat.geometry-table-set",
  "metadata": {
    "ccd_bcif_dir": null,
    "ccd_dir": null,
    "ccd_full": "https://files.wwpdb.org/pub/pdb/data/monomers/components.cif.gz",
    "provenance": {
      "command_args": [
        "geometry",
        "tables",
        "build-sidechain-ccd",
        "--ccd-full",
        "components.cif.gz",
        "--output-root",
        "derived/ccd-sidechains",
        "--table-set-id",
        "ccd-sidechain-geometry",
        "--table-set-version",
        "v1"
      ],
      "pheat_version": "0.1.0"
    },
    "residue_count": 29,
    "source": "wwpdb-ccd-full",
    "warnings": []
  },
  "pheat_version": "0.1.0",
  "profiles": {
    "ccd-sidechains": {
      "backbone": {},
      "metadata": {
        "kind": "sidechains",
        "placement_order_source": "pheat-template-order",
        "source": "wwpdb-ccd-full"
      },
      "sidechains": {
        "residues": {
          "ALA": {
            "placement_order_source": "pheat-template-order",
            "source": "wwpdb-ccd-full",
            "steps": []
          },
          "ARG": {
            "placement_order_source": "pheat-template-order",
            "source": "wwpdb-ccd-full",
            "steps": [
              {
                "anchor": "CA",
                "angle": 113.42200376130617,
                "atom": "CG",
                "dihedral": "chi1",
                "element": "C",
                "length": 1.5259728044758942,
                "parent": "CB",
                "previous": "N"
              },
              {
                "anchor": "CB",
                "angle": 111.75999795794188,
                "atom": "CD",
                "dihedral": "chi2",
                "element": "C",
                "length": 1.5221530803437577,
                "parent": "CG",
                "previous": "CA"
              },
              {
                "anchor": "CG",
                "angle": 111.9263994381031,
                "atom": "NE",
                "dihedral": "chi3",
                "element": "N",
                "length": 1.4601760167870204,
                "parent": "CD",
                "previous": "CB"
              },
              {
                "anchor": "CD",
                "angle": 124.58061024722475,
                "atom": "CZ",
                "dihedral": "chi4",
                "element": "C",
                "length": 1.328153982036722,
                "parent": "NE",
                "previous": "CG"
              },
              {
                "anchor": "NE",
                "angle": 120.39364987776757,
                "atom": "NH1",
                "dihedral": 0.0,
                "element": "N",
                "length": 1.3245535096778926,
                "parent": "CZ",
                "previous": "CD"
              },
              {
                "anchor": "NE",
                "angle": 119.80866458673663,
                "atom": "NH2",
                "dihedral": 180.0,
                "element": "N",
                "length": 1.3253003433184418,
                "parent": "CZ",
                "previous": "CD"
              }
            ]
          },
          "ASN": {
            "placement_order_source": "pheat-template-order",
            "source": "wwpdb-ccd-full",
            "steps": [
              {
                "anchor": "CA",
                "angle": 116.70061284064533,
                "atom": "CG",
                "dihedral": "chi1",
                "element": "C",
                "length": 1.4874141992061258,
                "parent": "CB",
                "previous": "N"
              },
              {
                "anchor": "CB",
                "angle": 125.04567660136432,
                "atom": "OD1",
                "dihedral": "chi2",
                "element": "O",
                "length": 1.222167746260719,
                "parent": "CG",
                "previous": "CA"
              },
              {
                "anchor": "CB",
                "angle": 112.28598020178228,
                "atom": "ND2",
                "dihedral": [
                  "chi2",
                  180.0
                ],
                "element": "N",
                "length": 1.3504240074880194,
                "parent": "CG",
                "previous": "CA"
              }
            ]
          },
          "ASP": {
            "placement_order_source": "pheat-template-order",
            "source": "wwpdb-ccd-full",
            "steps": [
              {
                "anchor": "CA",
                "angle": 112.54588725148312,
                "atom": "CG",
                "dihedral": "chi1",
                "element": "C",
                "length": 1.5311374856622118,
                "parent": "CB",
                "previous": "N"
              },
              {
                "anchor": "CB",
                "angle": 118.40433779559065,
                "atom": "OD1",
                "dihedral": "chi2",
                "element": "O",
                "length": 1.2545664589809535,
                "parent": "CG",
                "previous": "CA"
              },
              {
                "anchor": "CB",
                "angle": 118.39247134025787,
                "atom": "OD2",
                "dihedral": [
                  "chi2",
                  180.0
                ],
                "element": "O",
                "length": 1.2529429356519004,
                "parent": "CG",
                "previous": "CA"
              }
            ]
          },
          "CYS": {
            "placement_order_source": "pheat-template-order",
            "source": "wwpdb-ccd-full",
            "steps": [
              {
                "anchor": "CA",
                "angle": 115.54671064865923,
                "atom": "SG",
                "dihedral": "chi1",
                "element": "S",
                "length": 1.8185848894126477,
                "parent": "CB",
                "previous": "N"
              }
            ]
          },
          "GLN": {
            "placement_order_source": "pheat-template-order",
            "source": "wwpdb-ccd-full",
            "steps": [
              {
                "anchor": "CA",
                "angle": 112.0202684416914,
                "atom": "CG",
                "dihedral": "chi1",
                "element": "C",
                "length": 1.558115528450955,
                "parent": "CB",
                "previous": "N"
              },
              {
                "anchor": "CB",
                "angle": 114.28517707904858,
                "atom": "CD",
                "dihedral": "chi2",
                "element": "C",
                "length": 1.5117423722314574,
                "parent": "CG",
                "previous": "CA"
              },
              {
                "anchor": "CG",
                "angle": 120.19970926267293,
                "atom": "OE1",
                "dihedral": "chi3",
                "element": "O",
                "length": 1.2200413927404241,
                "parent": "CD",
                "previous": "CB"
              },
              {
                "anchor": "CG",
                "angle": 116.60375999472082,
                "atom": "NE2",
                "dihedral": [
                  "chi3",
                  180.0
                ],
                "element": "N",
                "length": 1.33467636526613,
                "parent": "CD",
                "previous": "CB"
              }
            ]
          },
          "GLU": {
            "placement_order_source": "pheat-template-order",
            "source": "wwpdb-ccd-full",
            "steps": [
              {
                "anchor": "CA",
                "angle": 113.43791657983236,
                "atom": "CG",
                "dihedral": "chi1",
                "element": "C",
                "length": 1.5178188297685586,
                "parent": "CB",
                "previous": "N"
              },
              {
                "anchor": "CB",
                "angle": 113.49054404937715,
                "atom": "CD",
                "dihedral": "chi2",
                "element": "C",
                "length": 1.521190652088028,
                "parent": "CG",
                "previous": "CA"
              },
              {
                "anchor": "CG",
                "angle": 119.46033992076994,
                "atom": "OE1",
                "dihedral": "chi3",
                "element": "O",
                "length": 1.2528084450545498,
                "parent": "CD",
                "previous": "CB"
              },
              {
                "anchor": "CG",
                "angle": 118.02003610295675,
                "atom": "OE2",
                "dihedral": [
                  "chi3",
                  180.0
                ],
                "element": "O",
                "length": 1.2491929394613113,
                "parent": "CD",
                "previous": "CB"
              }
            ]
          },
          "GLY": {
            "placement_order_source": "pheat-template-order",
            "source": "wwpdb-ccd-full",
            "steps": []
          },
          "HIS": {
            "placement_order_source": "pheat-template-order",
            "source": "wwpdb-ccd-full",
            "steps": [
              {
                "anchor": "CA",
                "angle": 113.99334430384602,
                "atom": "CG",
                "dihedral": "chi1",
                "element": "C",
                "length": 1.4974184451915882,
                "parent": "CB",
                "previous": "N"
              },
              {
                "anchor": "CB",
                "angle": 122.54686970809082,
                "atom": "ND1",